uid,body,title,url,newspaper_uid,host,n_tokens_ntitle,n_tokens_nbody
7d731fe2bbfdf57b843e96fa333f283d,"La época dorada del ciclismo en el Perú transcurrió entre mediados de los años 50 hasta los 70. El nombre del peruano, descendiente de japoneses, Teófilo Toda brillaba en la secciones deportivas de los diarios Shimbo Perú, La Crónica, La Prensa y El Comercio donde se daba cuenta de sus logros en el ciclismo de ruta.Teófilo Toda Nishimura, natural de Huacho, entrenaba con una bicicleta de carreras prestada por Lázaro Shiohama, miembro del club Unión Pacífico. De lunes a viernes se levantaba al amanecer y partía hacia Lurín. Los fines de semana demostraba su destreza en los torneos nacionales.Foto: Archivo Histórico El Comercio “Teófilo Toda estuvo en el club deportivo Cachorros de ciclismo. La marca Garozzo fue su patrocinador”, nos cuenta Luis Toyama, abogado y ex presidente de la Asociación Universitaria Nisei del Perú (AUNP). Durante nuestra conversación recordó algunas anécdotas como esta:“Un domingo Teófilo llegó al estadio Unión donde practicábamos para las competencias entre instituciones de atletismo. Nuestro club lo inscribió en una prueba de 1,500 metros. Nosotros pensábamos que para él sería fácil correr esa distancia. Sin embargo, aquel día Teófilo había ganado una competencia de 100 kilómetros entre Lima y la carretera Central. Por la tarde, dejó la bicicleta para correr los 1,500 metros. Obviamente no ganó. Teófilo nos explicó que las dos disciplinas requerían otro tipo de esfuerzos”.Tenía 18 años cuando en 1953 se alzó campeón en la categoría junior. Al año siguiente repitió la hazaña. Estos méritos le valieron ser incluido en la selección peruana de ciclismo. Sin embargo, el ciclista tuvo un gran revés cuando se le negó la visa para viajar a Montevideo y representar al Perú en un torneo sudamericano.En el ambiente deportivo había mucha expectativa por la participación de Perú en esta competencia. Junto a Teófilo Toda estaban cuatro ciclistas italianos nacionalizados peruanos. El Comercio en su edición del 9 de febrero de 1954 tituló: “Ha llamado mucho la atención la ausencia de Teófilo Toda”. Hasta ese momento nada hacia presagiar que el gobierno de Manuel A. Odría había impedido, sin argumento alguno, su viaje.Este ciclista terminó a las justas la competencia realizada en julio de 1960. En aquella ocasión Toda se coronó campeón. Foto: Archivo Histórico El Comercio Aunque ya había transcurrido casi una década del fin de la Segunda Guerra Mundial, los sentimientos en contra de los descendientes de japoneses en el Perú aún estaban a flor de piel. La actitud del gobierno abrió el debate sobre la discriminación hacia la comunidad nikkei. El “Caso Toda”, como se le conoció por esos días, generó una cadena de solidaridad e indignación. Los miembros de su equipo se rehusaron a participar del torneo. Los editoriales de los diarios abogaban por la igualdad de derechos para los nisei cuya contribución a la sociedad peruana era muy destacada.Teófilo Toda continuó ganando torneos en las pistas peruanas. “Toda fue campeón de ruta por 5 a 6 años. Era un ganador nato”, nos cuenta Luis Toyama. Gracias a sus logros, la Federación Peruana de Ciclismo designó a Toda como participante en los Juegos Olímpicos de Tokio 1964. Sin embargo, no había dinero para financiar sus pasajes y estadía.“Por eso la Asociación Universitaria Nisei del Perú (AUNP), decidió apoyar a Teófilo Toda”, rememora Luis Toyama y añade: “el ingeniero Carlos Tsuboyama, secretario de deportes de nuestra institución, inició las labores para juntar auspiciadores”. El AELU prestó sus instalaciones para realizar los eventos pro fondos. Los clubes Los Cachorros, Unión Pacífico, Nisei Callao, Hinode, la empresa Farr Tours, entre otras colaboraron para que Teófilo Toda compita en las pistas japonesas.Foto: Delegación peruana durante la inauguración de los Juegos Olímpicos de Tokio 1964. Radiofoto de la agencia UPI Gracias a la unión de la comunidad nikkei, Teófilo Toda pudo viajar a Japón junto a 30 deportistas más. La prueba individual de ciclismo de ruta se realizó el 22 de octubre de 1964. Este circuito pasaba por las localidades de Akishima, Hino y Tachikawa, con partida y llegada en Hachioji, Tokio. Fueron 107 participantes que recorrieron 194 kilómetros. Teófilo Toda llegó en el puesto 84. A su retorno continuó participando en torneos hasta que en 1965 se retiró. En la actualidad tiene 85 años y vive con su esposa en Japón."," Teófilo Toda, la leyenda del ciclismo peruano que se convirtió en símbolo contra la discriminación",https://elcomercio.pe/archivo-elcomercio/teofilo-toda-la-leyenda-del-ciclismo-peruano-que-se-convirtio-en-simbolo-contra-la-discriminacion-noticia/,elcomercio,elcomercio.pe,8,368
1a230a1da7ae005be6c323b8d56a2fc1,"Clima en Lima | El Servicio Nacional de Meteorología e Hidrología del Perú (Senamhi) pronosticó que la temperatura mínima en Lima Este será de 13°C para este lunes 29 de junio de 2020.Según la entidad del Ministerio del Ambiente (Minam), la temperatura máxima será de 21°C. Además, indicó que se espera cielo cubierto a cielo nublado durante el día.En Lima Oeste, la temperatura máxima llegaría a 19°C, mientras que la mínima sería de 15°C. Se pronostica cielo cubierto a cielo nublado durante el día, llovizna ligera y ráfagas de viento.Invierno con temperaturas normalesEl Servicio Nacional de Meteorología e Hidrología del Perú (Senamhi) informó que la estación de invierno se inició el sábado 20 de junio y durará hasta el 22 de setiembre a las 8:30 a.m. De acuerdo con la entidad, las ciudades costeras presentarán temperaturas del aire entre ligeramente frías a normales debido a la mayor concentración de humedad por la presencia de nieblas, neblinas y lloviznas usuales para la época.La ciudad de Lima alcanzaría temperaturas próximas a 14°C en las noches, y alrededor de 19°C durante el día. No se descarta que se presenten algunos días más fríos de lo usual, y temperaturas de hasta 12°C en las noches, acompañados de valores altos de humedad (próximos a 97%) como parte de la estacionalidad.En la costa norte, se esperan registros que fluctuarán entre 16°C y 27°C, y en la costa sur oscilarán entre 11°C y 23°C.Lluvias en todo el paísSenamhi sostuvo que para la temporada de invierno se pronostica que aún se presenten precipitaciones por encima del promedio mensual, principalmente en la selva norte. Sin embargo, debido a que nos encontramos en el periodo de estiaje, éstas no serían significativas. Por otro lado, en el resto del país se presentarán lluvias entre normales e inferiores a sus rangos esperados para la temporada.VIDEO RECOMENDADOCoronavirus en Perú: Restaurantes abrirán sus locales con un aforo máximo de 40%", Senamhi | Clima en Lima HOY martes 30 de junio: la ciudad registrará una temperatura mínima de 14°C ,https://elcomercio.pe/lima/senamhi-clima-en-lima-hoy-martes-30-de-junio-la-ciudad-soportara-una-temperatura-minima-de-14c-nndc-noticia/,elcomercio,elcomercio.pe,10,144
d130443558ed02112297a516476802c5,"En el nuevo edificio de El Comercio, en Santa Catalina, lo primero que se ve cuando se cruzan los accesos es una enorme caricatura de Guillermo Osorio, el querido ilustrador peruano. Su sección, La Caricatura del Día, era esperada como el pan más rico de la panadería. La primera portada de El Comercio, el sábado 4 de mayo de 1839, no parece escrita sino dibujada. el marco donde se lee Orden, Libertad y Saber y las 2 carabelas que anuncian el primer párrafo de la historia de este diario. De todas las joyas gráficas que protege nuestro archivo (el más grande del Perú, con más de 4 millones de negativos, otros 5 millones a color, más de 2 millones de fotos impresas, 117 placas de vidrio y más de 7 mil ilustraciones históricas), son las portadas ilustradas por los más grandes dibujantes de todas las épocas las que más bellas se ven, año a año. En 1949, por ejemplo, Miguel Miró Quesada de la Guerra rindió homenaje a las mujeres protagonistas del año con un dibujo en portada. Fue él mismo quien ilustró la tapa del Centenario, en 1921: el pabellón, los libertadores San Martín y Bolívar y la mujer, símbolo de la libertad.Es imposible olvidarnos del Supercholo, la historieta que empezó a salir en 1957. O de Mafalda, cuyas aventuras se publicaron en El Comercio desde 1962. Desde lejos, en mi caverna futbolera de Deporte Total, vi cómo el maestro Alonso Núñez obtuvo el premio de la SIP en 2009 por una caricatura de Bush.En El Comercio el arte tuvo un espacio enorme desde siempre. Escribir y fotografiar lo es. Pero el caso de los dibujantes, los ilustradores, su magnetismo está en decir sin palabras lo que otros solo pueden gritar.Víctor Aguilar Rúa y Giovanni Tazza son dos de los ilustradores de El Comercio que recibieron esa herencia. Su silenciosa presencia en el diario termina cuando terminan de ilustrar las páginas más importantes del diario al día siguiente: allí es todo explosión. Ellos resumieron estos más de 100 días de cuarentena con unos dibujos que se publicaron en este diario y que ahora los reunimos para no olvidar el tiempo que pasó. Les pedimos que resuman lo que cada trazo significó para ellos.El resultado es esta increíble antología.Víctor Aguilar RúaIlustrador de El Comercio. Autor de libros gráficos de distinta temática. Hincha del poeta Enrique Verástegui, como lo prueba ESTA ILUSTRACIÓN.Ilustración para el reportaje sobre el día a día en casa de la familia del primer paciente detectado con Covid-19 en el Perú. Hubo que dibujar una escena familiar en base a los datos que se nos dieron. Utilizamos el cómic para dar a conocer el testimonio de cuatro profesionales de la salud que son parte de el gran ejercito que combate la pandemia en primera línea. Un cómic informativo, dirigido a los niños, que muestra de manera sencilla y amena, cómo se producen los contagios por Coronavirus y las recomendaciones que debemos seguir para evitar el contagio teniendo al jabón como un aliado importante. Como una manera de impulsar y recordar las recomendaciones y disposiciones para evitar los contagios, se crearon 30 stickers para Whatsapp con frases informativas y motivadoras. Al llegar a su fin el confinamiento para los niños, se nos ocurrió la idea de crear máscaras de animalitos del Perú para hacer más divertidos los pequeños paseos. Giovanni TazzaIlustrador en el diario El Comercio de Perú desde el 2015. Artista plástico egresado de Pintura de la Escuela Superior de Bellas Artes del Perú. Trabaja dando servicios de artes visuales como ilustración digital, dibujos, pinturas, murales diseños y asesorías visuales.El Covid-19, tan indescifrable como impredecible, ruge y estremece de miedo a la población y a sus líderes políticos. En un estado de aislamiento comprendemos que a pesar de las cortas distancias físicas las psíquicas pueden ser mayores cuando la cercanía es sinónimo de peligro.  Luego de la llegada del covid 19 todos los hábitos de vida han cambiado. Nuestros rostros son acompañados de una mascarilla todo el tiempo, el miedo y la desconfianza frente al otro es una constante sin tiempo de expiración. En un Estado de Emergencia el personal de salud hace un gran esfuerzo por salvar vidas usando uno de los elementos más preciados, y a veces tan poco valorados, el oxígeno. El distanciamiento social ha generado vacíos en nuestras formas de relacionarnos entre nosotros, nuestros seres queridos, y nuestras futuras relaciones. Durante la cuarentena no queda otra que llevar nuestra vida personal y laboral a casa. Nuestro universo creativo como recreativo se reduce a algunos metros cuadros con la esperanza de algún momento poder expandir nuestros territorios. TAMBIÉN PUEDES LEER:", Las 10 mejores ilustraciones de los artistas de El Comercio en 100 días de cuarentena,https://elcomercio.pe/desde-la-redaccion/palabra-del-decano/coronavirus-peru-las-10-mejores-ilustraciones-de-los-artistas-de-el-comercio-en-100-dias-de-cuarentena-ilustraciones-diario-el-comercio-noticia/,elcomercio,elcomercio.pe,6,375
d182d0fc7c7e057bcc2db936d677889d,"Horóscopo de hoy | 30 de junio | Tarot | Conoce lo que te deparan las estrellas en el amor y el trabajo, según los signos del zodiaco. Como ya es habitual, compartimos aquí el horóscopo de hoy. Esto es lo que dice tu signo para este martes 30 de junio del 2020.ARIES (marzo 21-abril 20) Trabajo y negocios: un negocio que no arroja buenos resultados hará surgir diferencias entre asociados. Amor: deja de lado la ternura y se enoja por tonterías. Esa actitud no ayudará.TAURO (abril 21-mayo 20) Trabajo y negocios: transforma la rigidez en actos responsables. Así disipará las dudas en un negocio. Amor: gestos de su pareja hacen que vea fantasmas donde no los hay; cálmese.GEMINIS (mayo 21-junio 21) Trabajo y negocios: durante un viaje, hallará a un amigo enredado en problemas y lo ayudará. Amor: su pareja le confiesa que no está a gusto con sus planes. No sea obstinado y escuche.CANCER (junio 22-julio 22) Trabajo y negocios: haga las cosas con atención; riesgo de pérdidas o demoras en asuntos comerciales. Amor: se sentirá feliz porque le manifiestan el afecto en momentos inesperados.LEO (julio 23-agosto 22) Trabajo y negocios: le llegan indicios de que el próximo ascenso será para usted. Sus ingresos mejorarán. Amor: alguien tímido estimula sus ganas de dar protección. Se avecina dulce romance.VIRGO (agosto 23-septiembre 22) Trabajo y negocios: su entorno le pedirá que se ponga al frente de las cosas; debe poner condiciones. Amor: las discusiones dejarán algo imborrable en cada integrante de la pareja.LIBRA (septiembre 23-octubre 22) Trabajo y negocios: le atraviesa cierto desánimo al intentar cosas nuevas. Llega el dinero esperado. Amor: una ex pareja le confunde porque elogia sus virtudes. Debe revisar su corazón.ESCORPIO (octubre 23-noviembre 21)Trabajo y negocios: no será difícil alejar a alguien que le trae problemas. Habrá reacción. Amor: le cautiva alguien discreto que prefiere el misterio. Conviene acercarse lentamente.SAGITARIO (noviembre 22-diciembre 21) Trabajo y negocios: se avecinan gastos para los que no hay dinero pero podrá lograrlo. Amor: el encanto de alguien recién llegado estimulará su curiosidad y querrá acercarse.CAPRICORNIO (diciembre 22-enero 20) Trabajo y negocios: un asunto delicado será manejado con mucho tacto y obtendrá una ventaja. Amor: el éxito personal fortalece su imagen y atrae una bella persona de su entorno.ACUARIO (enero 21-febrero 19) Trabajo y negocios: llegan ganancias que ya no espera y alivia un momento difícil. Hora de gastar. Amor: en su entorno, alguien confesará que se siente cautivado por su encanto.PISCIS (febrero 20-marzo 20) Trabajo y negocios: una ráfaga de buena fortuna permite que muchos de sus sueños se concreten. Amor: confiesa sus sentimientos a un compañero laboral y se inicia un secreto romance.", Horóscopo: las predicciones más acertadas de hoy martes 30 de junio del 2020,https://elcomercio.pe/luces/vida-social/horoscopo-de-hoy-martes-30-de-junio-del-2020-esto-dice-tu-signo-zodiacal-tarot-gratis-amor-noticia/,elcomercio,elcomercio.pe,6,227
aa3603992144bb4db6630b7ae148b383,"Vince McMahon, presidente de WWE, tuvo un aumento de 177 millones de dólares en su patrimonio a pesar de los estragos del Covid-19. Su fortuna pasó de 1.800 millones de dólares en marzo a ser de 1.977 millones de dólares en junio. Este informe fue publicado por el periódico The Middleton Press haciendo referencia a los multimillonarios de Connecticut. MIRA: El plan B después del fútbol: la decisión de estudiar cuando te alejas de las canchasEste incremento supone un 9.8% de su fortuna que no sufrió algún declive ante la pandemia del coronavirus. Con esto, los rumores de una posible quiebra quedarían injustificados y los masivos despidos de abril serían para equilibrar los gastos. Tom Swan, director ejecutivo del CCAG (Grupo de Acción Ciudadana de Connecticut) opinó sobre los resultados de este informe: “Esto es un claro recordatorio del nivel de desigualdad en Connecticut. También deja claro que cualquier argumento de austeridad es falso cuando la legislatura comience a lidiar con el legado de la supremacía blanca de Connecticut y los desafíos presupuestarios que se avecinan”. MIRA: El abrazo de siempre, el abrazo es contigo, Perú: el triunfazo ante Uruguay en la Copa del 2019Cabe recordar que McMahon tuvo momentos que parecían ser grandes golpes para su patrimonio. La quiebra de XFL y una serie de demandas a WWE son parte de ello. Sumado a esto, hubo despidos masivos en abril con el objetivo de recortar gastos. MÁS EN DT...Nicolás Fuentes: el lateral izquierdo de Perú que recién descubrimos los jóvenes, 50 años despuésLiga 1: Deportivo Municipal anunció un caso positivo por coronavirus entre sus trabajadoresSporting Cristal confía en la continuidad de Ray Sandoval: “Estamos contentos con Ray y él se quiere quedar”WWE Monday Night Raw EN VIVO: INICIÓ el evento en el Performance Center de Florida | EN DIRECTOManual para volver a gritar un gol de la Blanquirroja en una Copa del MundoNO DEJES DE VER", WWE: El patrimonio de Vince McMahon ha tenido un aumento de 177 millones de dólares,https://elcomercio.pe/deporte-total/polideportivo/wwe-el-patrimonio-de-vince-mcmahon-ha-tenido-un-aumento-de-177-millones-de-dolares-noticia/,elcomercio,elcomercio.pe,7,166
