uid,body,title,url,newspaper_uid,host,n_tokens_ntitle,n_tokens_nbody
ba64c049c36442f609e64dfb869dc1b7,"Adaptar las clases a plataformas online ha sido la única opción del sector educación a raíz de la pandemia. En el caso de las universidades del país, esta transformación se convierte en una oportunidad para desarrollar su oferta de maestrías y acercarla aún más a los potenciales estudiantes de posgrado.MIRA: Comisión del Congreso aprueba propuesta para reprogramar el pago de créditos por 90 díasComo en todo proceso, se enfrentan desafíos. En el caso de la Universidad de Lima, se inició un proceso de capacitación a todo el personal docente, con el objetivo de utilizar la plataforma digital. “Este nuevo entorno requiere conocer un nuevo campo para la mayoría de docentes y decidimos acompañarlos en ello”, comenta la vicerrectora de la referida universidad, Patricia Stuart.Pasada dicha etapa, las ventajas de cara a los propios estudiantes son múltiples. “Antes era muy complicado invitar al presidente de una empresa o inclusive a alguien del exterior. Por las plataformas, ha sido muy fácil integrar el mundo internacional a nuestras clases”, señala. Hasta este momento, la Universidad de Lima solo tenía maestrías presenciales y para las especialidades de Tributación y Política Fiscal, Derecho Empresarial, Dirección Estratégica de Contenidos, entre otras especialidades.Estudiantes optan por las experiencias digitales para estudios de postgrado. (Foto: AFP) Sin embargo, ya se evalúa ofrecer desde el próximo año las mismas maestrías y otras nuevas en formatos semipresenciales. “Lanzaremos una maestría en Gestión Financiera, otra en Marketing y Gestión Comercial y una tercera en Gestión y Estrategia”, explica la vicerrectora.Apostar por este tipo de cursos online le permite a las universidades ofrecerle a sus estudiantes interactuar con profesionales, docentes y colegas de calidad. Un ‘networking’ digital que termina siendo favorable para el desarrollo profesional.Es una de las ventajas que destaca la escuela de negocios online ThePowerMBA al referirse a las maestrías online. “Resulta fundamental crear una buena red de profesionales, con el objetivo de familiarizarse con el mundo empresarial y estar al corriente de las oportunidades laborales que puedan aparecer en otras regiones”, recalca.Y esta resulta ser una cualidad que genera interés entre los estudiantes peruanos al momento de decidir qué maestría llevar. Datos recientes recabados por ThePowerMBA demuestran que, de sus 5.000 alumnos en América Latina, 1.500 pertenecen al Perú.MIRA: Mincetur: restaurantes abrirán sus locales con un aforo máximo de un 40% desde julioEstrategia y competenciaEn el caso de las universidades peruanas, este cambio tecnológico y metodológico se convierte también en una potencial posibilidad para su crecimiento. En opinión de Roberto Urrunaga, director general de las escuelas de posgrado de la Universidad del Pacífico, este cambio permitirá llevar la educación más allá de Lima. “Si un estudiante vive en Huancayo o en otra región, seguramente tenía pocas alternativas para una maestría. Ahora, se puede acceder a las universidades top del país y también del mercado internacional. Para nosotros, es un tremendo reto”, comenta.Desde marzo, la universidad lleva a cabo todos sus cursos tanto en pregrado como en posgrado a través del canal online. Es esa experiencia la que le permitirá ampliar su oferta con una maestría semipresencial en Administración, la misma que ya fue aprobada por la Sunedu el pasado viernes y que se suma a las propuestas presenciales de sus dos escuelas: Pacífico Business School y la Escuela de Gestión Pública.Urrunaga advierte que el canal online abrirá una competencia entre universidades que tendrá resultados positivos. “Se incrementará la calidad de los productos. Tendremos que competir con oferta que no esperábamos, como el extranjero. Las universidades que no estén preparadas, se irán retirando o achicando; pero aquellas que ya nos estábamos preparando, nos debe motivar a invertir más y mejorar”, dice en diálogo con Día1.MIRA: Ministro de Salud: Buses interprovinciales y aviones podrán operar con el 100% de sus asientosGuillermo Quiroga, director académico de la Escuela de Posgrado de la UPC, considera necesario entender que de aquí en adelante la oferta educativa apostará más por lo semipresencial. “Hay muchas cosas que serán más viables para canales online y otras que todavía serán necesarias impartir a través del la modalidad presencial”, asevera.A su vez, ello llevará a cambiar la metodología. “Hay que cambiar el modelo de evaluación a proyectos y opiniones. Esto acorde con las exigencias mundiales. Habrá los que digan que lo antiguo era mejor, pero lo que queremos es que esté mejor preparado para el futuro”, comenta.La UPC en el 2009 lanzó sus maestrías online, entre las cuales se encuentra un MBA, maestría en Gestión Pública, Administración y Dirección de Proyectos y Dirección Estratégica del Factor Humano.“Estamos trabajando aceleradamente para ofrecer más maestrías online. Por efecto del COVID-19, la educación ha acelerado su proceso de reinversión”, acota.MIRA: Empleo formal revierte tendencia a la baja: se crearon 84.000 puestos de trabajo en tres semanas de junioNOTAS RELACIONADASLinde Praxair: “Haremos todos los esfuerzos para importar oxígeno donde lo encontremos”Sector turismo: ¿cuándo se podría volver a tener resultados como los vistos antes de la pandemia?Restaurantes: ¿cuáles son algunos de los protocolos que se aplicarán para la atención en salón?La mayoría de restaurantes podrá atender en salón desde “el 2 de julio o 3 de julio”, anuncia BarriosIndicca: Pesimismo en los consumidores de Lima Metropolitana alcanza su mayor nivel en casi 15 añosVIDEO RELACIONADOReactivación de Gamarra: ¿cuál es la situación del emporio de La Victoria?", Maestrías: Universidades cuentan cómo mejorarán su propuesta en formatos online,https://elcomercio.pe/economia/dia-1/maestrias-universidades-cuentan-como-mejoraran-su-propuesta-en-formatos-online-universidad-de-lima-universidad-del-pacifico-upc-noticia/,elcomercio,elcomercio.pe,8,437
ac9365648085ffa91b4a7882f8d71e33,"La crisis sanitaria ha impactado fuertemente en distintos negocios. Sucedió también con la televisión, cuyo ingreso más importante es la inversión publicitaria. América Televisión, líder entre las casas televisoras, no fue la excepción. En conversación con Día1, Pablo Massi, gerente general del canal, detalla cómo han sido estos meses para América TV, los cambios que tuvieron que realizar a nivel de parrilla a medida que avanzaba la pandemia y los proyectos que han dejado en ‘stand by’. También hace mención a los rumores de venta del canal.MIRA: Latina: “Nosotros gestionamos la compañía pensando que estará a cargo de Enfoca y de los accionistas actuales”¿Cómo han sido estos meses de cuarentena para América Televisión?Nos ha afectado en varios frentes. Si vemos el lado positivo, la cuarentena ha generado un alza en el encendido de televisores para la señal abierta. En lo negativo, nuestra facturación cayó bruscamente en abril, fue brutal. Pero nos estamos recuperando un poco, junio está siendo mejor que mayo. No obstante, como todo negocio, tengo que decir que es un año para olvidar.¿Este mes está marcando, entonces, una recuperación sostenida? ¿Podrían cerrar el año en una situación estable?Sí. En mayo hubo una mejora y en junio estamos viendo una recuperación [de la inversión publicitaria]. En abril estuvimos a un 30% de lo proyectado y ahora en junio vamos al 75% de lo estimado. El primer objetivo es que los accionistas no tengan pérdidas y eso lo cumpliremos a fin de año. Dependerá de cómo se desarrolle esta situación tras la cuarentena y del último trimestre. Mi proyección es positiva, creo que el negocio no perderá dinero e, inclusive, quizá podría tener algunos márgenes [de ganancia].Las primeras campañas publicitarias fuertes del año quedaron truncas o no se dieron. Además, este 2020 tenían los derechos de transmisión de las Eliminatorias Qatar 2022 (partidos de visita) y de la Copa América 2021, que se han aplazado. ¿Esto ha movido su presupuesto?En el caso de la Copa América o de las Eliminatorias, si bien no tendremos el ingreso [en las fechas previstas], tampoco tendremos el gasto, por lo que no hay mayor perjuicio. Sobre campañas como el Día de la Madre, son importantes, pero definitivamente no llegan a ser como julio. Nosotros tenemos muchas expectativas de seguir peleando el año.Foto 4 |  América Televisión y Canal N suscribieron un acuerdo para trabajar en conjunto con Discovery Networks Latin America/ US Hispanic, una división de Discovery Communications, con el cual los canales locales serán representantes exclusivos de ventas publicitarias de Discovery en el Perú. Asimismo, tiene acuerdos con Televisa y otras casas televisoras en el exterior. ¿Cuáles han sido los sectores que han vuelto a invertir en la televisión?Las marcas de alimentos, higiene, supermercados no han tenido mayor problema. Las tiendas por departamento se han vuelto a pronunciar porque ya están retomando ventas, al igual que restaurantes, por el delivery. Pero al sector belleza le está costando, las líneas aéreas probablemente no anuncien hasta fin de año y el sector automotriz está muy golpeado. La situación se va a ir recomponiendo, pero va a ser un proceso lento.¿Han ingreso nuevos sectores, quizá ligados al e-commerce o delivery?Los punto com siempre han sido aliados de la televisión. Acá todavía no están en el top 10 de anunciantes, pero ya vas viendo a algunos como las ‘apps’ de delivery, las apuestas en línea, o de idiomas y lo van a hacer cada vez más. Lo otro que hemos notado es que, dado que la gente ahora está más dispuesta a cambiar de marcas, el líder de la categoría está tratando de defender su posición y el retador ganar más espacio.Eso está generando la reactivación de algunas categorías.Por lo general, los acuerdos comerciales los realizan en las preventas, ¿han tenido que renegociar contratos de publicidad? América ya tenía muchos de los acuerdos establecidos, pero no todos firmados, ya que la cuarentena llegó en el momento en el que estos se materializaban. Se suele negociar dos o tres meses y luego ver los términos finales, entonces –como estábamos en ese proceso– esto hizo que revisemos algunos puntos, no necesariamente sobre las tarifas. Ajustamos y ahora tenemos la mayoría de contratos firmados, no han variado mucho. Pero algunos anunciantes sí rescindieron contratos.A pesar de la crisis, ¿los interesados en auspiciar la Copa América 2021 y las Eliminatorias se mantienen?No hemos avanzando mucho en ese tema. La Copa América será el próximo año y creemos que tendrá la misma cantidad de interesados. Quizá los partidos de Eliminatorias me pueden preocupar un poco, lo mejor sería que pasen al 2021. Pero aunque fueran este año, estoy seguro de que las marcas estarán.CONTENIDOS Y PROYECTOS¿Han realizado cambios en la parrilla durante la crisis sanitaria y el aumento de encendidos?La gente al inicio estaba muy ansiosa de la información, pero también estamos notando que la gente está un poco saturada y quieren un poco más de entretenimiento. Por eso volvió Rebeca y Esto es Guerra, para equilibrar. De vuelta al barrio demorará más y evaluaremos si podremos tener algún show los fines de semana.¿Cuánto del total de los contenidos del canal son producción local?Desde hace siete años, nuestro ‘prime time’ es totalmente de contenido local. El 60% de nuestra programación es producción local y si no producimos series las reemplazamos con otros contenidos. En cuarentena no han bajado, se han incrementado. Ahora tenemos 5 alianzas con productoras, todas activas.Desde hace unos años, tienen una alianza con Televisa, ¿cómo va?Sí, comercializamos los canales de cable de Televisa. Esta relación se ha visto fortalecida con un nuevo contrato que nos da más derechos. Por ejemplo, pudimos producir la versión peruana de La Rosa de Guadalupe.¿En qué quedaron los proyectos con Radio Disney? ¿Lanzarán el nuevo dial este año?Así es, estamos asociados y produciendo con Radio Disney. Falta la segunda emisora con ellos, justo estamos discutiendo si tiene o no sentido hacerlo este año o si esperamos un momento más estable. Nosotros vemos el capital y la parte comercial.“El primer objetivo es que los accionistas no tengan pérdidas y eso sucederá a fin de año”¿Cuál será el perfil de la segunda emisora?Esta emisora será distinta. Todavía no puedo adelantar qué tipo de emisora será o el dial, estamos en plena negociación y hay aspectos que no hemos podido avanzar mucho.¿Veremos más proyectos en revisión?Los extremadamente importantes y estratégicos siguen adelante y otros han sido aplazados. Este año es un reto. Con los proyectos, evidentemente, estamos siendo más cuidadosos. La mayoría han sido aplazados o le hemos dado un respiro, como el de radio, porque estamos ocupados en salir de la crisis.¿Cómo se ajusta la radio al negocio central de América, que es la televisión abierta? ¿Son complementarios?Sí, lo que queremos es darle valor a la marca. A veces haces algo no por el negocio inmediato o por ingresos sino porque aportas valor a mediano y largo plazo. Por eso también entramos a digital (con América TV Go) y a otro tipo de medios. Sabemos que nuestro negocio central es la televisión lineal y estos son complementos importantes.¿América ha recurrido a la suspensión perfecta o a despidos?Tenemos un plan de acción con muchas medidas. Lo que te puedo decir es que hasta el momento no tuvimos que tomar decisiones difíciles. Pero no sabemos más adelante. estamos monitoreando la situación.Hace unas semanas se comentaba que CNN estaba interesada en América y en los medios del grupo.A mi me han informado oficialmente que esa información no es verdad, la descarto. Incluso se dijo que canal N reportaba pérdidas y eso no es cierto. El canal hoy es, más bien, el único que no reporta pérdidas.Si no fue CNN, ¿hubo otras propuestas? Hemos tenido muchas propuestas [de fondos de inversión y medios de comunicación de otros países] anteriormente y los primeros en enterarnos somos nosotros porque cuando se da ese interés, nos contactan para conocer el estado de la empresa. No hay propuesta económica formal antes de eso. El año pasado tuvimos a un interesado y el proceso tardó 8 meses. Al final no se dio por una tema entre el valor de compra y venta.TE PUEDE INTERESARLinde Praxair: “Haremos todos los esfuerzos para importar oxígeno donde lo encontremos”El panorama sombrío del sector turismo con más de US$2.000 millones en pérdidas | INFORMESalud financiera de bancos en riesgo por iniciativas de Congreso¿Ley para la protección de pueblos indígenas pone en riesgo la producción de gas y petróleo?Bono de electricidad beneficiará a más de 5,3 mlls. de hogares, ¿cuáles serán las condiciones para recibirlo?Inmobiliarias: ¿qué beneficios y facilidades de compra se ofrecen a través de canales digitales?"," América TV: “Al inicio la gente estaba ansiosa por información, ahora está un poco saturada y busca entretenimiento”",https://elcomercio.pe/economia/dia-1/america-television-el-objetivo-es-no-reportar-perdidas-y-eso-sucedera-a-fin-de-ano-publicidad-entrevista-noticia/,elcomercio,elcomercio.pe,10,666
fad84b4b2a33b5c93c6a6795abafe80c,"El videojuego de realidad aumentada Pokémon Go acaba de cumplir cuatro años y anunció una serie de desafíos semanales junto a un evento de celebración en línea, el Pokémon GO Fest. De esta forma, Niantic busca mantener activos a su comunidad a pesar de las limitaciones que impone la cuarentena por la pandemia de COVID-19 en todo el mundo.Lanzado en julio de 2016 para los sistemas operativos Android e iOS, Pokémon Go se convirtió en un fenómeno mundial con una propuesta de juego que combinaba el uso de la tecnología de realidad aumentada con la cámara y el GPS de los teléfonos móviles.Desde abril Pokémon Go permite que los jugadores puedan realizar accesos de forma remota a los gimnasios. Para este verano boreal, Niantic preparó una serie de desafíos semanales en forma de líneas de investigación temporal. La semana 1 se llevará a cabo desde el viernes 3 hasta el miércoles 8 de julio y los jugadores podrán desbloquear más especies de Pokémon que estarán disponibles en el Pokémon GO Fest 2020, el encuentro virtual para celebrar el cuarto aniversario del juego.Whether you’re a new Trainer or an ace with years of experience, we’re happy to celebrate four wonderful years of Pokémon GO adventures with you! Let’s keep it going! Prepare for a summer of exciting events leading up to #PokemonGOFest2020! https://t.co/afPjNNiPdL pic.twitter.com/kVrZiinxw8— Pokémon GO (@PokemonGoApp) June 25, 2020 Para esta ocasión, Niantic aprovechó la ocasión para revelar algunos datos de uso de Pokémon Go , un juego que fomentó el ejercicio y la interacción con el mundo real , según sus creadores. “Los entrenadores han recorrido más de 28 mil millones de kilómetros y han visitado más de 290 millones de lugares jugando a Pokémon Go . Esto nos motiva día a día a crear productos y una tecnología de realidad aumentada subyacente que cumpla con este objetivo para nuestros jugadores”, dijo Niantic.“Durante el evento por el cuarto aniversario, aparecerán Pokémon especiales en estado salvaje, al eclosionar Huevos y en incursiones, ¡sobre todo Pikachu volador! Con un poco de suerte, podrán conocer a un Pikachu volador variocolor“, dijo la compañía en un comunicado oficial.Esta edición del Pokémon GO Fest se realizará de forma en línea con un alcance global, donde se podrán conocer más de 75 especies de Pokémon en estado salvaje . La participación en el festival virtual, que se llevará a cabo el 25 y 26 de julio , costará unos US$14,99, y parte de los ingresos serán destinados al apoyo de diversas organizaciones sin fines de lucro en Estados Unidos. Todas las novedades sobre los eventos y desafíos están disponibles en el sitio oficial de Pokémon Go Live.Con información de La Nación de Argentina (GDA). Síguenos en Twitter...Seguir a @tecnoycienciaEC

Tweets by tecnoycienciaEC", Pokémon Go celebra sus cuatro años con un festival en línea y nuevos desafíos,https://elcomercio.pe/tecnologia/e-sports/pokemon-go-celebra-sus-cuatro-anos-con-un-festival-en-linea-y-nuevos-desafios-noticia/,elcomercio,elcomercio.pe,9,250
ac5cd4f1ff00b0982cf7292ca3cd8385,"La cantante Leslie Shaw sigue ratificando que es la artista nacional con mayor ascenso internacional, tras el lanzamiento de su single “Estoy Soltera”, donde une su voz a la de Thalía y Farina. El single de Shaw cuenta con más de 9 millones de reproducciones en la plataforma YouTube a menos de una semana de su lanzamiento oficial.Leslie Shaw: imágenes que no se vieron del videoclip de “Estoy soltera” con Thalía y FarinaLeslie Shaw y su consagración internacional: narra su fascinante experiencia de grabar con ThalíaAdemás, la artista peruana ha sentado un precedente en las redes sociales al batir récord con un promedio de 1 millón de reproducciones diarias en la plataforma de YouTube, hecho que ningún cantante o artista peruano había alcanzado hasta el día de hoy.De esta manera, Leslie Shaw escribe una página en la historia de la música no solo en nuestro país sino en el mercado latino. Es la primera cantautora peruana que logra grabar con una mega estrella del calibre de la mexicana Thalía y con la número uno de Colombia, Farina.Shaw, quien actualmente se encuentra en Miami, empezó el tour promocional de “Estoy Soltera” con México y Perú, y seguirá con Colombia y Estados Unidos.Es preciso mencionar que el videoclip oficial de “Estoy Soltera” fue rodado en Manhattan, New York, bajo la dirección de la cineasta Katherine Diaz (Kath D), quien supo capturar la esencia femenina única de Leslie Shaw y sus invitadas de lujo.         Ver esta publicación en Instagram           Sé libre de amar a quien quieras y siéntete orgulloso de ser quien eres. #LOVEISLOVE #lgtbi #pride 🏳️‍🌈🏳️‍🌈🏳️‍🌈🏳️‍🌈 Una publicación compartida por  Leslie Shaw (@leslieshaw) el 28 de Jun de 2020 a las 5:39 PDT VIDEO RECOMENDADOLeslie Shaw expresa su deseo de grabar tema con MalumaLeslie Shaw confiesa sus deseos de grabar tema musical con Maluma", “Estoy Soltera” de Leslie Shaw bate récord en YouTube,https://elcomercio.pe/luces/musica/leslie-shaw-bate-record-en-youtube-con-estoy-soltera-cancion-registra-un-millon-de-reproducciones-diarias-en-la-plataforma-thalia-farina-video-nndc-noticia/,elcomercio,elcomercio.pe,6,159
